{
  "$schema": "http://json-schema.org/draft-07/schema#",
  "title": "Maini vai mainies items",
  "type": "array",
  "items": {
    "type": "object",
    "additionalProperties": false,
    "required": ["id", "sentence", "choices", "answer", "hint", "explain", "tags"],
    "properties": {
      "id": { "type": "string", "minLength": 1 },
      "sentence": { "type": "string", "minLength": 1 },
      "choices": {
        "type": "array",
        "items": { "type": "string", "minLength": 1 },
        "minItems": 2
      },
      "answer": { "type": "string", "minLength": 1 },
      "hint": { "type": "string", "minLength": 1 },
      "explain": { "type": "string", "minLength": 1 },
      "tags": {
        "type": "array",
        "items": { "type": "string", "minLength": 1 },
        "minItems": 1
      }
    }
  }
}
